J;"Peruma, A; Simmons, S; AlOmar, EA; Newman, CD; Mkaouer, MW; Ouni, A";;;;"Peruma, Anthony; Simmons, Steven; AlOmar, Eman Abdullah; Newman, Christian D.; Mkaouer, Mohamed Wiem; Ouni, Ali";;;How do i refactor this? An empirical study on refactoring trends and topics in Stack Overflow;EMPIRICAL SOFTWARE ENGINEERING;;;;;;;;;;;;An essential part of software maintenance and evolution, refactoring is performed by developers, regardless of technology or domain, to improve the internal quality of the system, and reduce its technical debt. However, choosing the appropriate refactoring strategy is not always straightforward, resulting in developers seeking assistance. Although research in refactoring is well-established, with several studies altering between the detection of refactoring opportunities and the recommendation of appropriate code changes, little is known about their adoption in practice. Analyzing the perception of developers is critical to understand better what developers consider to be problematic in their code and how they handle it. Additionally, there is a need for bridging the gap between refactoring, as research, and its adoption in practice, by extracting common refactoring intents that are more suitable for what developers face in reality. In this study, we analyze refactoring discussions on Stack Overflow through a series of quantitative and qualitative experiments. Our results show that Stack Overflow is utilized by a diverse set of developers for refactoring assistance for a variety of technologies. Our observations show five areas that developers typically require help with refactoring- Code Optimization, Tools and IDEs, Architecture and Design Patterns, Unit Testing, and Database. We envision our findings better bridge the support between traditional (or academic) aspects of refactoring and their real-world applicability, including better tool support.;;;;;"Mkaouer, Mohamed Wiem/N-7476-2017; AlOmar, Eman/ABW-2622-2022";"Mkaouer, Mohamed Wiem/0000-0001-6010-7561; AlOmar, Eman/0000-0003-1800-9268; Ouni, Ali/0000-0003-4708-0362; Simmons, Steven/0000-0003-3081-8500; Peruma, Anthony/0000-0003-2585-657X; Newman, Christian/0000-0002-8838-4074";;;;;;;;;;;;;1382-3256;1573-7616;;;;JAN;2022;27;1;;;;;;;11;10.1007/s10664-021-10045-x;http://dx.doi.org/10.1007/s10664-021-10045-x;;;;;;;;;;;;;WOS:000710216100003;
C;"Dobslaw, F; Vallin, M; Sundstrom, R";;;IEEE Comp Soc;"Dobslaw, Felix; Vallin, Morgan; Sundstrom, Robin";;;Free the Bugs: Disclosing Blocking Violations in Reactive Programming;2020 20TH IEEE INTERNATIONAL WORKING CONFERENCE ON SOURCE CODE ANALYSIS AND MANIPULATION (SCAM 2020);IEEE International Working Conference on Source Code Analysis and Manipulation;;;;20th IEEE International Working Conference on Source Code Analysis and Manipulation (SCAM);SEP 27-28, 2020;ELECTR NETWORK;IEEE,IEEE Comp Soc;;;;In programming, concurrency allows threads to share processing units interleaving and seemingly simultaneous to improve resource utilization and performance. Previous research has found that concurrency faults are hard to avoid, hard to find, often leading to undesired and unpredictable behavior. Further, with the growing availability of multi-core devices and adaptation of concurrency features in high-level languages, concurrency faults occur reportedly often, which is why countermeasures must be investigated to limit harm. Reactive programming provides an abstraction to simplify complex concurrent and asynchronous tasks through reactive language extensions such as the RxJava and Project Reactor libraries for Java. Still, blocking violations are possibly resulting in concurrency faults with no Java compiler warnings. BlockHound is a tool that detects incorrect blocking by wrapping the original code and intercepting blocking calls to provide appropriate runtime errors. In this study, we seek an understanding of how common blocking violations are and whether a tool such as BlockHound can give us insight into the root-causes to highlight them as pitfalls to developers. The investigated Softwares are Java-based open-source projects using reactive frameworks selected based on high star ratings and large fork quantities that indicate high adoption. We activated BlockHound in the project's test-suites and analyzed log files for common patterns to reveal blocking violations in 7/29 investigated open-source projects with 5024 stars and 1437 forks. A small number of system calls could be identified as root-causes. We here present countermeasures that successfully removed the uncertainty of blocking violations. The code's intentional logic was retained in all validated projects through passing unit-tests.;;;;;;;;;;;;;;;;;;;1942-5430;;978-1-7281-9248-2;;;;2020;;;;;;;177;186;;10.1109/SCAM51674.2020.00025;http://dx.doi.org/10.1109/SCAM51674.2020.00025;;;;;;;;;;;;;WOS:000647642000020;
C;"Bree, DC; Cinneide, MO";;;IEEE COMP SOC;"Bree, Deaglan Connolly; Cinneide, Mel O.";;;Removing Decorator to Improve Energy Efficiency;2022 IEEE INTERNATIONAL CONFERENCE ON SOFTWARE ANALYSIS, EVOLUTION AND REENGINEERING (SANER 2022);European Conference on Software Maintenance and Reengineering;;;;29th IEEE International Conference on Software Analysis, Evolution and Reengineering (SANER);MAR 15-18, 2022;ELECTR NETWORK;IEEE,IEEE Comp Soc;;;;With growing concerns regarding climate change and rising energy costs, there is an increased focus on improving the energy efficiency of software. One relevant avenue of research is the transformation of software designs in order to increase efficiency and reduce energy consumption. Design Patterns are of interest here as the indirection they introduce is likely to have a detrimental effect on energy consumption. In this paper we report on our investigations into the impact on energy consumption of the Decorator pattern, which is a structural design pattern used to enable additional behaviour to be attached to an individual component dynamically. Application of this pattern improves the maintainability of software at the cost of increased indirection and redundancy, which may reduce energy efficiency. In this paper we explore features of the Decorator pattern that impact on its systematic removal, with a future goal of removing this pattern using automated refactoring. We subsequently examine experimentally the Decorator pattern's impact on energy consumption in Java and find its implementation results in an increased number of instantiated objects and method invocations at run-time. The removal of the pattern can result in up to a 96% reduction in energy consumption in a best-case scenario with a textbook example, and up to a 5% reduction in energy consumption in an open-source project with a case study examining JUnit, a popular unit testing framework for Java. These results demonstrate the energy savings achievable with the removal of Decorator pattern instances and open the way for similar investigations of other design patterns.;;;;;;Connolly Bree, Deaglan/0000-0001-9038-2134;;;;;;;;;;;;;1944-2793;;978-1-6654-3786-8;;;;2022;;;;;;;902;912;;10.1109/SANER53432.2022.00108;http://dx.doi.org/10.1109/SANER53432.2022.00108;;;;;;;;;;;;;WOS:000855050800096;
C;"Shimmi, S; Rahimi, M";;;IEEE Comp Soc;"Shimmi, Samiha; Rahimi, Mona";;;Leveraging Code-Test Co-evolution Patterns for Automated Test Case Recommendation;3RD ACM/IEEE INTERNATIONAL CONFERENCE ON AUTOMATION OF SOFTWARE TEST (AST 2022);;;;;3rd ACM/IEEE International Conference on Automation of Software Test (AST);MAY 17-18, 2022;ELECTR NETWORK;IEEE,Assoc Comp Machinery,IEEE Comp Soc;;;;Context: Prior research revealed that code components with similar structures tend to require structurally similar test cases and they often co-evolve over time. Objective: Leveraging this pattern, we implemented a prototype tool, Test Suite Evolver (TSE), to support the generation of test cases for structurally similar methods. Our prototype tool is applicable to both, incomplete test suites with the purpose of test case augmentation, as well as evolving test suites when a newer version of a software becomes available. Method: Making use of the aforementioned code-test co-evolution pattern, TSE leverages source code structural similarity and a set of existing test cases to synthesise and recommend new unit tests. For this, TSE initially identifies groups of structurally similar methods in the code, determines changes at the token-level, and integrates the retrieved information to synthesise updated test cases. Results: Our evaluations indicated that 38% of the source code of five large open-source applications consist of methods which are structurally similar to each other and therefore for which, the co-evolution pattern holds. Applying TSE to these methods, TSE generated 72% of the minimum required test cases with only 11% token-based edit distance between the generated test cases and those written by developers. To evaluate the test cases' validity, we used code2vec, a neural network to measure the structural and semantic similarity between the generated and developed test cases. The results indicated that TSE successfully generated test cases with a similarity measure of more than 80% in more than 95.6% of test cases and similarity measure of 100% for 88.35% of the test cases. Conclusion: The evaluations revealed that TSE is able to generate the majority of the necessary test cases with an insignificant amount of modifications required from the developers.;;;;;;;;;;;;;;;;;;;;;978-1-4503-9286-0;;;;2022;;;;;;;65;76;;10.1145/3524481.3527222;http://dx.doi.org/10.1145/3524481.3527222;;;;;;;;;;;;;WOS:000850254300008;
J;"Derakhshanfar, P; Devroey, X; Panichella, A; Zaidman, A; van Deursen, A";;;;"Derakhshanfar, Pouria; Devroey, Xavier; Panichella, Annibale; Zaidman, Andy; van Deursen, Arie";;;Generating Class-Level Integration Tests Using Call Site Information;IEEE TRANSACTIONS ON SOFTWARE ENGINEERING;;;;;;;;;;;;"Search-based approaches have been used in the literature to automate the process of creating unit test cases. However, related work has shown that generated tests with high code coverage could be ineffective, i.e., they may not detect all faults or kill all injected mutants. In this paper, we propose Cling, an integration-level test case generation approach that exploits how a pair of classes, the caller and the callee, interact with each other through method calls. In particular, Cling generates integration-level test cases that maximize the Coupled Branches Criterion (CBC). Coupled branches are pairs of branches containing a branch of the caller and a branch of the callee such that an integration test that exercises the former also exercises the latter. CBC is a novel integration-level coverage criterion, measuring the degree to which a test suite exercises the interactions between a caller and its callee classes. We implemented Cling and evaluated the approach on 140 pairs of classes from five different open-source Java projects. Our results show that (1) Cling generates test suites with high CBC coverage, thanks to the definition of the test suite generation as a many-objectives problem where each couple of branches is an independent objective; (2) such generated suites trigger different class interactions and can kill on average 7.7% (with a maximum of 50%) of mutants that are not detected by tests generated randomly or at the unit level; (3) Cling can detect integration faults coming from wrong assumptions about the usage of the callee class (25 for our subject systems) that remain undetected when using automatically generated random and unit-level test suites.";;;;;"Zaidman, Andy/O-6542-2014; van Deursen, Arie/G-3084-2011";"Zaidman, Andy/0000-0003-2413-3935; van Deursen, Arie/0000-0003-4850-3312; Derakhshanfar, Pouria/0000-0003-3549-9019";;;;;;;;;;;;;0098-5589;1939-3520;;;;APR 1;2023;49;4;;;;;2069;2087;;10.1109/TSE.2022.3209625;http://dx.doi.org/10.1109/TSE.2022.3209625;;;;;;;;;;;;;WOS:000978723600037;
J;"Mattiello, GR; Endo, AT";;;;"Mattiello, Guilherme Ricken; Endo, Andre Takeshi";;;Model-based testing leveraged for automated web tests;SOFTWARE QUALITY JOURNAL;;;;;;;;;;;;Agile methods and their practices have fostered the widespread presence of automated test cases. Such test cases have been successfully and extensively adopted to test different software levels, from unit tests (e.g., JUnit) to end-to-end Web Graphical User Interface (GUI) tests (e.g., Selenium Webdriver). While test execution is mostly automated by existing tools, test design remains a manual task. In the pursuit of a more automated test case generation approach, the use of models has been advocated by the model-based testing (MBT) technique. Current MBT approaches assume a top-down workflow in which testers design models, test cases are generated from models, and then scripts are written to automate test execution. Nevertheless, writing automated tests is nowadays a developer's responsibility and testers face a scenario in which automated tests might be reused to produce new model-based tests. This paper aimed to improve the synergy between existing automated tests and MBT. To do so, we present an approach that infers a model from existing tests, a tester leverages this model to include new tests, and then test code is generated. We analyzed the proposed approach in the context of Web applications with system-level GUI tests that employ the Page Object pattern. For MBT, we adopted event-driven models augmented with parameters and test input data. We evaluated the approach's applicability with a prototype tool called MoLeWe and an experimental study with nine open-source Web applications. The results provide some evidence that using MoLeWe may help to include new tests faster than manually coding them, while increasing the overall code coverage of the test suite.;;;;;Endo, Andre Takeshi/I-1861-2012;Endo, Andre Takeshi/0000-0002-8737-1749;;;;;;;;;;;;;0963-9314;1573-1367;;;;SEP;2022;30;3;;;;;621;649;;10.1007/s11219-021-09575-w;http://dx.doi.org/10.1007/s11219-021-09575-w;;NOV 2021;;;;;;;;;;;WOS:000722964800001;
J;"Sun, JCY; Liu, YM; Lin, X; Hu, X";;;;"Sun, Jerry Chih-Yuan; Liu, Yiming; Lin, Xi; Hu, Xiao";;;Temporal learning analytics to explore traces of self-regulated learning behaviors and their associations with learning performance, cognitive load, and student engagement in an asynchronous online course;FRONTIERS IN PSYCHOLOGY;;;;;;;;;;;;Self-regulated learning (SRL) plays a critical role in asynchronous online courses. In recent years, attention has been focused on identifying student subgroups with different patterns of online SRL behaviors and comparing their learning performance. However, there is limited research leveraging traces of SRL behaviors to detect student subgroups and examine the subgroup differences in cognitive load and student engagement. The current study tracked the engagement of 101 graduate students with SRL-enabling tools integrated into an asynchronous online course. According to the recorded SRL behaviors, this study identified two distinct student subgroups, using sequence analysis and cluster analysis: high SRL (H-SRL) and low SRL (L-SRL) groups. The H-SRL group showed lower extraneous cognitive load and higher learning performance, germane cognitive load, and cognitive engagement than the L-SRL group did. Additionally, this study articulated and compared temporal patterns of online SRL behaviors between the student subgroups combining lag sequential analysis and epistemic network analysis. The results revealed that both groups followed three phases of self-regulation but performed off-task behaviors. Additionally, the H-SRL group preferred activating mastery learning goals to improve ethical knowledge, whereas the L-SRL group preferred choosing performance-avoidance learning goals to pass the unit tests. The H-SRL group invested more in time management and notetaking, whereas the L-SRL group engaged more in surface learning approaches. This study offers researchers both theoretical and methodological insights. Additionally, our research findings help inform practitioners about how to design and deploy personalized SRL interventions in asynchronous online courses.;;;;;"Yan, Jun/IXD-7801-2023; Liu, Yi/HTN-4916-2023; Liu, Yiming/ISU-3780-2023; Liu, Kai/IST-6808-2023";LIU, Yiming/0000-0003-2604-7993;;;;;;;;;;;;;1664-1078;;;;;JAN 23;2023;13;;;;;;;;1096337;10.3389/fpsyg.2022.1096337;http://dx.doi.org/10.3389/fpsyg.2022.1096337;;;;;;;;36755979;;;;;WOS:000926239100001;
C;"Buttu, M; Bartolini, M; Migoni, C; Orlati, A; Poppi, S; Righini, S";;"Chiozzi, G; Guzman, JC";;"Buttu, M.; Bartolini, M.; Migoni, C.; Orlati, A.; Poppi, S.; Righini, S.";;;Rules of thumb to increase the software quality through testing;SOFTWARE AND CYBERINFRASTRUCTURE FOR ASTRONOMY IV;Proceedings of SPIE;;;;Conference on Software and Cyberinfrastructure for Astronomy IV;JUN 26-30, 2016;Edinburgh, SCOTLAND;SPIE;;;;"The software maintenance typically requires 40-80% of the overall project costs, and this considerable variability mostly depends on the software internal quality: the more the software is designed and implemented to constantly welcome new changes, the lower will be the maintenance costs. The internal quality is typically enforced through testing, which in turn also affects the development and maintenance costs. This is the reason why testing methodologies have become a major concern for any company that builds - or is involved in building - software. Although there is no testing approach that suits all contexts, we infer some general guidelines learned during the Development of the Italian Single-dish COntrol System (DISCOS), which is a project aimed at producing the control software for the three INAF radio telescopes (the Medicina and Noto dishes, and the newly-built SRT). These guidelines concern both the development and the maintenance phases, and their ultimate goal is to maximize the DISCOS software quality through a Behavior-Driven Development (BDD) workflow beside a continuous delivery pipeline. We consider different topics and patterns; they involve the proper apportion of the tests (from end-to-end to low-level tests), the choice between hardware simulators and mockers, why and how to apply TDD and the dependency injection to increase the test coverage, the emerging technologies available for test isolation, bug fixing, how to protect the system from the external resources changes (firmware updating, hardware substitution, etc.) and, eventually, how to accomplish BDD starting from functional tests and going through integration and unit tests. We discuss pros and cons of each solution and point out the motivations of our choices either as a general rule or narrowed in the context of the DISCOS project.";;;;;;"Bartolini, Marco/0000-0002-8293-7598; Righini, Simona/0000-0001-7332-5138; Orlati, Andrea/0000-0001-8737-255X; Poppi, Sergio/0000-0002-4698-2607";;;;;;;;;;;;;0277-786X;;"978-1-5106-0205-2; 978-1-5106-0206-9";;;;2016;9913;;;;;;;;UNSP 9913013;10.1117/12.2230626;http://dx.doi.org/10.1117/12.2230626;;;;;;;;;;;;;WOS:000388804600010;
C;"Sun, FZ; Zhang, P; White, J; Schmidt, DC; Staples, J; Krause, L";;;IEEE;"Sun, Fangzhou; Zhang, Peng; White, Jules; Schmidt, Douglas C.; Staples, Jacob; Krause, Lee";;;A Feasibility Study of Autonomically Detecting In-process Cyber-Attacks;2017 3RD IEEE INTERNATIONAL CONFERENCE ON CYBERNETICS (CYBCONF);IEEE International Conference on Cybernetics-CYBCONF;;;;3rd IEEE International Conference on Cybernetics (CYBCONF);JUN 21-23, 2017;Exeter, ENGLAND;IEEE,Univ Exeter,IEEE Syst, Man, & Cybernet Soc;;;;A cyber-attack detection system issues alerts when an attacker attempts to coerce a trusted software application to perform unsafe actions on the attacker's behalf. One way of issuing such alerts is to create an application-agnostic cyber-attack detection system that responds to prevalent software vulnerabilities. The creation of such an autonomic alert system, however, is impeded by the disparity between implementation language, function, Quality-of-Service (QoS) requirements, and architectural patterns present in applications, all of which contribute to the rapidly changing threat landscape presented by modern heterogeneous software systems. This paper evaluates the feasibility of creating an autonomic cyber-attack detection system and applying it to several exemplar web-based applications using program transformation and machine learning techniques. Specifically, we examine whether it is possible to detect cyber-attacks (1) online, i.e., as they occur using lightweight structures derived from a call graph and (2) offline, i.e., using machine learning techniques trained with features extracted from a trace of application execution. In both cases, we first characterize normal application behavior using supervised training with the test suites created for an application as part of the software development process. We then intentionally perturb our test applications so they are vulnerable to common attack vectors and then evaluate the effectiveness of various feature extraction and learning strategies on the perturbed applications. Our results show that both lightweight on-line models based on control flow of execution path and application specific off-line models can successfully and efficiently detect in-process cyber-attacks against web applications.;;;;;;;;;;;;;;;;;;;2475-6113;;978-1-5386-2201-8;;;;2017;;;;;;;407;414;;;;;;;;;;;;;;;;WOS:000414302500067;
C;"Abdelmeged, RG; Balagowni, S; Abdelaleem, A; Kwan, J; Kabeel, A; Rizk, S; Abouzeid, A";;"Kim, RH; Lafferty, NV";;"Abdelmeged, Ramy G.; Balagowni, Srinivas; Abdelaleem, Ahmed; Kwan, Joe; Kabeel, Aliaa; Rizk, Sarah; Abouzeid, Ahmed";;;Robust qualification flows for DRC decks using high coverage synthetic layout generation;DTCO AND COMPUTATIONAL PATTERNING;Proceedings of SPIE;;;;Conference on DTCO and Computational Patterning;APR 24-MAY 27, 2022;ELECTR NETWORK;SPIE;;;;Design rules are geometric constraints imposed on IC layout to ensure products can be manufactured at an acceptable yield. Designs are required to pass sign-off design rule check (DRC) before tape-out. Foundries rely on DRC to ensure designs they accept are manufacturable. DRC runsets must be accurate, complete, and reliable. DRC runset qualification is critical in technology node deployment and maturation. The number, complexity and variation of design rules grow dramatically with advancing technology nodes. This increases the QA challenge to ensure quality and accuracy of runsets and their interdependent rule operations. Traditional methods of migrating previous node QA patterns, manually crafting new testcases, and targeted-pattern generation leave gaps in advanced process node qualification coverage. We deploy a novel synthetic layout generation approach to produce large varieties of complex layouts with high design space coverage to thoroughly qualify runsets, make runset improvements and release quality PDKs. We employ guided random Monte Carlo layout generation with user-defined layout construction rules. User-defined rules inform DRC requirements and assign weighted priorities to guide layout design styles. We generate stress DR layouts and high pattern coverage, with DRC-clean patterns and with deliberate DRC violations, to validate expected DRC results and exercise entire rule decks. In this paper, we show how Synthetic Layout Generation is integrated into runset QA flows, automatically generating stress DR conditions that manual efforts often miss, expand layout pattern space coverage, and improve runset execution coverage leading to higher quality on-time PDK development, qualification, and release.;;;;;;;;;;;;;;;;;;;0277-786X;1996-756X;"978-1-5106-4980-4; 978-1-5106-4979-8";;;;2022;12052;;;;;;;;120520L;10.1117/12.2614085;http://dx.doi.org/10.1117/12.2614085;;;;;;;;;;;;;WOS:000844431900015;
