C;"Wiklund, K; Sundmark, D; Eldh, S; Lundqvist, K";;;IEEE;"Wiklund, Kristian; Sundmark, Daniel; Eldh, Sigrid; Lundqvist, Kristina";;;Impediments for Automated Testing - An Empirical Analysis of a User Support Discussion Board;2014 IEEE SEVENTH INTERNATIONAL CONFERENCE ON SOFTWARE TESTING, VERIFICATION AND VALIDATION (ICST);;;;;7th IEEE International Conference on Software Testing, Verification and Validation (ICST);MAR 31-APR 04, 2014;Cleveland, OH;IEEE Comp Soc,IEEE,ABB;;;;To better understand the challenges encountered by users and developers of automatic software testing, we have performed an empirical investigation of a discussion board used for support of a test automation framework having several hundred users. The messages on the discussion board were stratified into problem reports, help requests, development information, and feature requests. The messages in the problem report and help request strata were then sampled and analyzed using thematic analysis, searching for common patterns. Our analysis indicate that a large part of the impediments discussed on the board are related to issues related to the centralized IT environment, and to erroneous behavior connected to the use of the framework and related components. We also observed a large amount of impediments related to the use of software development tools. Turning to the help requests, we found that the majority of the help requests were about designing test scripts and not about the areas that appear to be most problematic. From our results and previous publications, we see a clear need to simplify the use, installation, and configuration of test systems of this type. The problems attributable to software development tools suggest that testers implementing test automation need more skills in handling those tools, than historically has been assumed. Finally, we propose that further research into the benefits of centralization of tools and IT environments, as well as structured deployment and efficient use of test automation, is performed.;;;;;;;;;;;;;;;;;;;;;978-0-7695-5185-2;;;;2014;;;;;;;113;122;;10.1109/ICST.2014.24;http://dx.doi.org/10.1109/ICST.2014.24;;;;;;;;;;;;;WOS:000355985000014;
J;"Yang, XB; Deng, HR; Zhang, XZ; Yang, DZ; Yan, JH; Yao, B; Weng, JP; Xu, W";;;;"Yang, Xubin; Deng, Hongrong; Zhang, Xiuzhen; Yang, Daizhi; Yan, Jinhua; Yao, Bin; Weng, Jianping; Xu, Wen";;;Insulin requirement profiles and related factors of insulin pump therapy in patients with type 2 diabetes;SCIENCE CHINA-LIFE SCIENCES;;;;;;;;;;;;"Continuous subcutaneous insulin infusion (CSII) is an effective therapy to control hyperglycemia in both patients with type 1 diabetes and type 2 diabetes. However, there is little data investigating the insulin dose setting during CSII therapy in type 2 diabetes to achieve optimal glycemic control and avoid the risk of hypoglycemia. Thus, this study is aimed to assess the dose characteristics of insulin requirement and explore the related clinical factors in patients with type 2 diabetes who were treated with CSII. A total of 327 patients (195 males) aged 52.9 +/- 12.5 years old were included in this study. Patients were treated with CSII to achieve the target fasting capillary blood glucose (4.4-7.0 mmol L-1) and 2-h postprandial capillary blood glucose (4.4-10.0 mmol L-1) by adjusting insulin infusion according to the seven-point capillary blood glucose profiles. Total daily insulin dose (TDD), total daily insulin dose per kilogram (TDD kg(-1)) and the ratio of total basal insulin dose (TBD) to TDD (%TBa) were calculated after patients achieved the glucose targets for at least 3 days via 1-2 weeks of CSII treatment. And insulin dose, insulin dosing patterns and the relevant clinical factors were analyzed. The mean ratio of basal/bolus insulin distribution of all patients was 40%:60%. Patients with central obesity needed more TDD (51.3 +/- 17.1 U versus 43.5 +/- 14.0 U, P<0.05) and TDD kg(-1) (0.8 +/- 0.3 U kg(-1) versus 0.7 +/- 0.2 U kg(-1), P<0.05) than those without central obesity. Pearson's correlation analysis demonstrated that TDD was positively correlated with body mass index (BMI), waist circumference (WC), baseline fasting plasma glucose (FPG), fasting C-peptide level, 2 h-postprandial C-peptide level and time to achieve glycemic target (all P<0.05); TDD kg(-1) was positively correlated with waist-to-hip ratio (WHR), baseline FPG, glycosylated hemoglobin A1c (HbA1c), fasting C-peptide level and time to achieve glycemic target, and negatively correlated with BMI (all P<0.05). Multiple linear regression analyses revealed that BMI (beta=1.796, P<0.01), WC (beta=0.709, P<0.01), baseline FPG (beta=1.459, P<0.01) and HbA1c (beta=0.930, P=0.021) were independently related to TDD. Gender (beta=-0.107, P=0.003), WC (beta=0.005, P=0.029), baseline FPG (beta=0.025, P<0.01) and HbA1c (beta=0.016, P=0.007) were independently associated with TDD kg(-1). Gender (beta=-0.015, P=0.048) and disease duration (beta=0.134, P=0.029) were independently associated with %TBa. %TBa is around 40% in Chinese patients with type 2 diabetes treated with CSII when glycemic control is achieved. In addition to body weight or BMI, WC and glucose levels before CSII should be considered to set TDD. Patients with central obesity or poor glycemic control might need more TDD. Higher %TBa should be considered in female patients or patients with longer disease duration.";;;;;Yang, Xubin/V-1455-2019;Weng, Jianping/0000-0002-7889-1697;;;;;;;;;;;;;1674-7305;1869-1889;;;;NOV;2019;62;11;;;;;1506;1513;;10.1007/s11427-018-9530-3;http://dx.doi.org/10.1007/s11427-018-9530-3;;;;;;;;31197759;;;;;WOS:000501478800007;
C;"Chakraborty, I; Kashyap, A; Kumar, A; Rastogi, A; Saran, H; Shorey, R";;;"IEEE; IEEE";"Chakraborty, I; Kashyap, A; Kumar, A; Rastogi, A; Saran, H; Shorey, R";;;MAC scheduling policies with reduced power consumption and bounded packet delays for centrally controlled TDD wireless networks;2001 IEEE INTERNATIONAL CONFERENCE ON COMMUNICATIONS, VOLS 1-10, CONFERENCE RECORD;;;;;IEEE International Conference on Communications;JUN 11-14, 2001;HELSINKI, FINLAND;IEEE,IEEE Communicat Soc,Globe Com;;;;In networks with mobile nodes, power consumption is an important constraint due to the limited battery power available at the mobile nodes. Reduction of power consumption in mobile devices can be achieved by keeping these devices In a low power (standby) mode during periods of inactivity. This may, however, result in increased end-to-end delays leading to violation of the Quality of Service (QoS) parameters. In this paper, we propose a Medium Access Control (MAC) scheduling policies for centrally controlled TDD wireless systems. The proposed policies reduce the power consumption of mobile devices by putting them into low power mode intelligently, using probabilistic estimates of inactivity based on the previous traffic arrival pattern. The policies ensure that the QoS parameters such as end-to-end packet delays are not violated.;;;;;Chakraborty, Indraneel/F-8103-2012;"Chakraborty, Indraneel/0000-0001-9389-7985; Shorey, Rajeev/0000-0003-3664-6527";;;;;;;;;;;;;;;0-7803-7097-1;;;;2001;;;;;;;1980;1984;;;;;;;;;;;;;;;;WOS:000173159000377;
J;"Nishimori, K; Cho, K; Takatori, Y; Hori, T";;;;"Nishimori, K; Cho, K; Takatori, Y; Hori, T";;;Automatic calibration method using transmitting signals of an adaptive array for TDD systems;IEEE TRANSACTIONS ON VEHICULAR TECHNOLOGY;;;;;;;;;;;;Adaptive arrays are especially effective in reducing cochannel interference and increasing channel capacity in time-division duplex (TDD) mobile communication systems because, ideally, the optimum pattern formed in the receiving mode can be applied to the transmitting pattern. However, since the radiation pattern of the adaptive array is generally formed on a baseband, the amplitude and phase errors must be calibrated between the branches of the array due to individual differences in the radio frequency (RF) devices of the receivers and transmitters. Moreover, since these errors change over time due to temperature variations, real-time calibration is required. This correspondence proposes an Automatic Calibration method using Transmitting signals (ACT) for adaptive base station antennas that is suitable for TDD communication systems, i.e., it enables real-time calibration. The effectiveness of the proposed calibration method is demonstrated using an experimental adaptive array testbed.;;;;;;;;;;;;;;;;;;;0018-9545;1939-9359;;;;NOV;2001;50;6;;;;;1636;1640;;10.1109/25.966592;http://dx.doi.org/10.1109/25.966592;;;;;;;;;;;;;WOS:000172302900028;
J;"Li, W; Zhao, DS; He, CY; Shen, Y; Hu, AD; Zhang, KF";;;;"Li, Wang; Zhao, Dongsheng; He, Changyong; Shen, Yi; Hu, Andong; Zhang, Kefei";;;Application of a Multi-Layer Artificial Neural Network in a 3-D Global Electron Density Model Using the Long-Term Observations of COSMIC, Fengyun-3C, and Digisonde;SPACE WEATHER-THE INTERNATIONAL JOURNAL OF RESEARCH AND APPLICATIONS;;;;;;;;;;;;The ionosphere plays an important role in satellite navigation, radio communication, and space weather prediction. However, it is still a challenging mission to develop a model with high predictability that captures the horizontal-vertical features of ionospheric electrodynamics. In this study, multiple observations during 2005-2019 from space-borne global navigation satellite system (GNSS) radio occultation (RO) systems (COSMIC and FY-3C) and the Digisonde Global Ionosphere Radio Observatory are utilized to develop a completely global ionospheric three-dimensional electron density model based on an artificial neural network, namely ANN-TDD. The correlation coefficients of the predicted profiles all exceed 0.96 for the training, validation and test datasets, and the minimum root-mean-square error of the predicted residuals is 7.8 x 10(4) el/cm(3). Under quiet space weather, the predicted accuracy of the ANN-TDD is 30%-60% higher than the IRI-2016 at the Millstone Hill and Jicamarca incoherent scatter radars. However, the ANN-TDD is less capable of predicting ionospheric dynamic evolution under severe geomagnetic storms compared to the IRI-2016 with the STORM option activated. Additionally, the ANN-TDD successfully reproduces the large-scale horizontal-vertical ionospheric electrodynamic features, including seasonal variation and hemispheric asymmetries. These features agree well with the structure revealed by the RO profiles derived from the FORMOSAT/COSMIC-2 mission. Furthermore, the ANN-TDD successfully captures the prominent regional ionospheric patterns, including the equatorial ionization anomaly, Weddell Sea anomaly and mid-latitude summer nighttime anomaly. The new model is expected to play an important role in the application of GNSS navigation and in the explanation of the physical mechanisms involved.;;;;;;Hu, Andong/0000-0002-6929-2158;;;;;;;;;;;;;;1542-7390;;;;MAR;2021;19;3;;;;;;;e2020SW002605;10.1029/2020SW002605;http://dx.doi.org/10.1029/2020SW002605;;;;;;;;;;;;;WOS:000636279600001;
C;"Meng, WX; Guo, Q";;"Zhang, LH; Wen, YH";;"Meng, WX; Guo, Q";;;A study on beam pattern forming for 8-element adaptive array in TDMA/TDD cellular communications;2002 3RD INTERNATIONAL SYMPOSIUM ON ELECTROMAGNETIC COMPATIBILITY;;;;;3rd International Symposium on Electromagnetic Compatibility;MAY 21-24, 2002;BEIJING, PEOPLES R CHINA;IEEE EMC Soc,Chinese Inst Electr,IEEE Beijing Sect,URSI Commiss E,IEE Beijing Ctr;;;;In this paper, an 8-elment adaptive array, which based on non-linear decision feedback equalizer and recursive least square is introduced for the post 3(rd) Generation TDMA/TDD mobile communications. The forming of beam pattern is declared the performance of boosting up the desired directions and canceling down the interference directions. Then the relationship between training sequence and beam pattern convergence is analyzed. Computer simulation results show the affiliation of beam forming and the directions of arrivals. The best length of training sequence for bean convergence is found.;;;;;;;;;;;;;;;;;;;;;0-7803-7277-8;;;;2002;;;;;;;158;161;;10.1109/ELMAGC.2002.1177390;http://dx.doi.org/10.1109/ELMAGC.2002.1177390;;;;;;;;;;;;;WOS:000181103100040;
J;"Malik, MI; Sindhu, MA; Khattak, AS; Abbasi, RA; Saleem, K";;;;"Malik, Maryam Imtiaz; Sindhu, Muddassar Azam; Khattak, Akmal Saeed; Abbasi, Rabeeh Ayaz; Saleem, Khalid";;;Automating test oracles from restricted natural language agile requirements;EXPERT SYSTEMS;;;;;;;;;;;;Manual testing of software requirements written in natural language for agile or any other methodology requires more time and human resources. This leaves the testing process error prone and time consuming. For satisfied end users with bug-free software delivered on time, there is a need to automate the test oracle process for natural language or informal requirements. The automation of the test oracle is relatively easier with formal requirements, but this task is difficult to achieve with natural language requirements. This study proposes an approach calledRestricted Natural Language Agile Requirements Testing(ReNaLART) to automate the test oracle from restricted natural language agile requirements. For this purpose, it uses an existing user story template with some modifications for writing user stories. This helps in identifying test input and expected output for a user story. For comparison of expected and observed outputs it makes use of a regex pattern and string distance functions. It is capable of assigning different types of verdicts automatically depending upon the similarity/dissimilarity between observed and expected outputs of user stories. ReNaLART is validated using several case studies of different domains, namely, OLX Pakistan, Mental Health Tests, McDelivery Pakistan, BlueStacks, Power Searching with Google, TensorFlow Playground, w3Schools 2018 offline and Touch'D. It revealed several faults in five of the above listed eight applications. Plus, the proposed test oracle on an average took 0.02 s for test data generation, expected output generation and verdict assignment. Both these facts show the fault revealing effectiveness and efficiency of ReNaLART.;;;;;"Saeed, Akmal/AAZ-8110-2021; Saleem, Khalid/ACQ-6881-2022; Saleem, Khalid/AAD-9293-2021; Sindhu, Muddassar Azam/GXF-0221-2022; Malik, Maryam/ITU-4703-2023; Abbasi, Rabeeh/B-4495-2011; Sindhu, Muddassar Azam/O-3216-2013";"Sindhu, Muddassar Azam/0000-0002-3411-9224; Abbasi, Rabeeh/0000-0002-3787-7039; Sindhu, Muddassar Azam/0000-0002-3411-9224";;;;;;;;;;;;;0266-4720;1468-0394;;;;JAN;2021;38;1;;;SI;;;;e12608;10.1111/exsy.12608;http://dx.doi.org/10.1111/exsy.12608;;JUL 2020;;;;;;;;;;;WOS:000551088800001;
J;"Chu, PH; Hsueh, NL; Chen, HH; Liu, CH";;;;"Chu, Peng-Hua; Hsueh, Nien-Lin; Chen, Hong-Hsiang; Liu, Chien-Hung";;;A test case refactoring approach for pattern-based software development;SOFTWARE QUALITY JOURNAL;;;;;;;;;;;;"In the current trend, Extreme Programing methodology is widely adopted by small and medium-sized projects for dealing with rapidly or indefinite changing requirements. Test-first strategy and code refactoring are the important practices of Extreme Programing for rapid development and quality support. The test-first strategy emphasizes that test cases are designed before system implementation to keep the correctness of artifacts during software development; whereas refactoring is the removal of bad smell code for improving quality without changing its semantics. However, the test-first strategy may conflict with code refactoring in the sense that the original test cases may be broken or inefficient for testing programs, which are revised by code refactoring. In general, the developers revise the test cases manually since it is not complicated. However, when the developers perform a pattern-based refactoring to improve the quality, the effort of revising the test cases is much more than that in simple code refactoring. In our observation, a pattern-based refactoring is composed of many simple and atomic code refactorings. If we have the composition relationship and the mapping rules between code refactoring and test case refactoring, we may infer a test case revision guideline in pattern-based refactoring. Based on this idea, in this research, we propose a four-phase approach to guide the construction of the test case refactoring for design patterns. We also introduce our approach by using some well-known design patterns and evaluate its feasibility by means of test coverage.";;;;;;;;;;;;;;;;;;;0963-9314;1573-1367;;;;MAR;2012;20;1;;;;;43;75;;10.1007/s11219-011-9143-x;http://dx.doi.org/10.1007/s11219-011-9143-x;;;;;;;;;;;;;WOS:000298864600002;
C;"Jeong, W; Kavehrad, M";;;"IEEE; IEEE; IEEE";"Jeong, W; Kavehrad, M";;;Dynamic-TDD and optimum slot-allocation in fixed cellular systems;IEEE 54TH VEHICULAR TECHNOLOGY CONFERENCE, VTC FALL 2001, VOLS 1-4, PROCEEDINGS;IEEE Vehicular Technology Conference Proceedings;;;;54th IEEE Vehicular Technology Conference (VTC 2001);OCT 07-11, 2001;ATLANTIC CITY, NJ;IEEE, N Jersey Sect,IEEE Vehicular Technol Soc;;;;Dynamic TDD (D-TDD) has gained attention as a means to deliver high dense two-way traffic. However, the outage performance of D-TDD system is severely limited by the strong interference from co-channel cells in a downlink cycle, while the reference cell is in its uplink duty cycle. To suppress the co-channel interference during uplink reception, we consider two kinds of time slot allocation strategies, combined with sector antennas: MaxMin {SIR} and Max {SIR}. MaxMin {SIR} is an optimum time slot allocation strategy, in the sense that it maximizes the minimum signal to interference ratio expectation value over extra uplink time slot region. It is used as a performance benchmark in our analysis. Meanwhile, Max {SIR} is a simple and efficient algorithm to improve outage performance. It is established that the performance difference between the two algorithms is not noticeable, especially when the dynamic range of traffic pattern between the uplink and downlink is small. Also, outage performance comparison between Max {SIR} algorithm and adaptive array antennas is provided. The proposed system shows promise and offers a compromise between system complexity and the desired availability.;;;;;Kavehrad, Mohsen/AAJ-1958-2021;;;;;;;;;;;;;;1550-2252;;0-7803-7005-8;;;;2001;;;;;;;37;41;;;;;;;;;;;;;;;;WOS:000173938400008;
C;"Kishiyama, Y; Nishimura, T; Ohgane, T; Ogawa, Y; Doi, Y";;;"IEEE; IEEE";"Kishiyama, Y; Nishimura, T; Ohgane, T; Ogawa, Y; Doi, Y";;;Weight estimation for downlink null steering in a TDD/SDMA system;2000 IEEE 51ST VEHICULAR TECHNOLOGY CONFERENCE, PROCEEDINGS, VOLS 1-3;;;;;51st Vehicular Technology Conference;MAY 15-18, 2000;TOKYO, JAPAN;IEEE,NTT,Panasonic,Mitsubishi,DDI,Denso,Japan Radio Co Ltd,NGK Spark Publ Co Ltd,Nokia,Agilent Technol,Cybernet Syst,Fujitsu,Toshiba,Tu-ka,IDO,Denki Kogyo Co Ltd,Toyo Corp,Ericsson,Kokusai Elect,HP Invent,SEI,Motorola,Kyocera,KDD,Lucent Technol,Nurata Mfg Co Ltd,Advantest,OKI,Hitachi,NEC,J-Phone,AKM,Sony,Inritsu,Sanyo,SPC Electr,Toyocom;;;;In employing an adaptive array for TDD/SDMA at a base station, generally, the array pattern for downlink is calculated from that for uplink. Considering the angle spread in a Rayleigh fading channel, time difference between uplink and downlink causes null position change on the optimum array pattern. In this paper, we propose the weight estimation method for the downlink null steering. It is based on the indirect weight estimation using the channel response prediction. The computer simulations show that the proposed method improves the BER performance in the downlink, effectively.;;;;;"Ohgane, Takeo/A-5239-2012; Nishimura, Toshihiko/D-6383-2012";;;;;;;;;;;;;;;;0-7803-5718-3;;;;2000;;;;;;;346;350;;;;;;;;;;;;;;;;WOS:000089401500071;
J;"Kiani, S; Irannezhad, M; Ronkanen, AK; Moradkhani, H; Klove, B";;;;"Kiani, Sepideh; Irannezhad, Masoud; Ronkanen, Anna-Kaisa; Moradkhani, Hamid; Klove, Bjorn";;;Effects of recent temperature variability and warming on the Oulu-Hailuoto ice road season in the northern Baltic Sea;COLD REGIONS SCIENCE AND TECHNOLOGY;;;;;;;;;;;;In cold climate regions, ice roads are engineered as temporary winter transportation routes on frozen lakes, rivers and seas. The ice road season start, end and duration principally depend upon ice thickness, which is controlled by surface air temperature (SAT) in terms of freezing and thawing degree-days (FDD and TDD, respectively). Both FDD and TDD are indicators of climate variability and change, and are naturally influenced by large-scale atmospheric circulation patterns (ACPs). This study examined the role of ACPs in interannual variations in the operating season of the Oulu-Hailuoto ice road in the Bay of Bothnia, northern Baltic Sea, during 1974-2009. Significant (p < .05) shortening in duration of the ice road season, mainly attributable to later start and earlier end days, was observed. In the Oulu-Hailuoto area, maximum ice thickness showed significant declines over time. This sea ice thinning was associated with SAT warming in cold months, manifested by statistically significant decreases in cumulative FDD during October-January within the water year (September-August). Significant increases in cumulative TDD during February-April, reflecting warmer SAT in mild months, resulted in earlier end day for the Oulu-Hailuoto ice road season. The Arctic Oscillation (AO) was the most influential ACP for variations in cumulative FDD (October-January), and accordingly for sea ice thickness and start day of the Oulu-Hailuoto ice road season. However, cumulative TDD (February-April) showed significant positive correlations with the East Atlantic (EA) pattern, which also controlled the end day of the Oulu-Hailuoto ice road season.;;;;;"Ronkanen, Anna-Kaisa/AAZ-1000-2020; Moradkhani, Hamid/B-1571-2012";"Ronkanen, Anna-Kaisa/0000-0003-3137-6388; Moradkhani, Hamid/0000-0002-2889-999X; Irannezhad, Masoud/0000-0002-9634-5622; Klove, Bjorn/0000-0002-2353-1440; Kiani, Sepideh/0000-0003-0581-2385";;;;;;;;;;;;;0165-232X;1872-7441;;;;JUL;2018;151;;;;;;1;8;;10.1016/j.coldregions.2018.02.010;http://dx.doi.org/10.1016/j.coldregions.2018.02.010;;;;;;;;;;;;;WOS:000432682200001;
J;"Bin Amin, MF; Motomura, K; Hizawa, T; Piedra-Lorenzana, JA; Nakai, T; Ishikawa, Y";;;;"Bin Amin, Mohd Faiz; Motomura, Kazuki; Hizawa, Takeshi; Piedra-Lorenzana, Jose A.; Nakai, Tetsuya; Ishikawa, Yasuhiko";;;Reduced threading dislocation density in a germanium epitaxial film coalesced on an arrayed silicon-on-insulator strip;JAPANESE JOURNAL OF APPLIED PHYSICS;;;;;;;;;;;;This paper reports a reduction in the threading dislocation density (TDD) of a Ge epitaxial film on a Si-on-insulator (SOI) wafer in terms of the Si-photonics device application. An array of submicron SOI strips is prepared as a patterned substrate, on which Ge is epitaxially grown by chemical vapor deposition. A continuous Ge film is formed by a coalescence of the adjacent Ge crystals on the arrayed SOI strip, while leaving semicylindrical voids on the exposed surface of the buried SiO2 (BOX) layer between the strips. The TDD of the coalesced Ge film is reduced to 1.0 +/- 0.1 x 10(8 )cm(-2), which is approximately a half of 2.2 +/- 0.2 x 10(8 )cm(-2) for a Ge film on an unpatterned SOI. A transmission electron microscope observation reveals that the TDD reduction is derived from a downward bending of the dislocation toward the void. An accumulation of the dislocations at the strip sidewalls also contributes to the TDD reduction.;;;;;Ishikawa, Yasuhiko/L-8874-2014;;;;;;;;;;;;;;0021-4922;1347-4065;;;;SEP 1;2022;61;9;;;;;;;95506;10.35848/1347-4065/ac8630;http://dx.doi.org/10.35848/1347-4065/ac8630;;;;;;;;;;;;;WOS:000842239100001;
