J;"Yu, WJ; Wang, W; Hua, XD; Wei, XY";;;;"Yu, Weijie; Wang, Wei; Hua, Xuedong; Wei, Xueyan";;;Exploring Taxi Demand Distribution of Comprehensive Land-Use Patterns Using Online Car-Hailing Data and Points of Interest in Chengdu, China;TRANSPORTATION RESEARCH RECORD;;;;;;;;;;;;With the rapid advance of urbanization, land-use intensity is increasing, and various land-use forms gather to form comprehensive land-use patterns. Traffic demand shows variability and complexity under comprehensive land-use patterns. Accurate analysis of traffic demand in urban transportation is the key to active traffic control and road guidance. Researchers have widely studied the relationship between traffic demand and land-use patterns, while land-use intensity is ignored when classifying land-use patterns, and the traffic demand distribution in each land-use pattern is not studied specifically. Taxi is a flexible public mode in urban areas, and taxi demand is an important component in analyzing traffic demand and identifying traffic hotspots in cities. This paper explores taxi demand distribution of comprehensive land-use patterns using online car-hailing data and points of interest (POI) in Chengdu, China. The demand-driven traffic analysis zones are developed by clustering origin-destination points of online car-hailing services. Using POI data, comprehensive land-use patterns are classified with land-use forms and land-use intensity. The K-shape algorithm is adopted to extract the typical taxi demand distribution in each comprehensive land-use pattern. Finally, two indicators, total taxi demand (TTD) and taxi demand difference (TDD), are computed and further analyzed. Results show that taxi demand distribution is still differential even under the same land-use pattern. Three land-use patterns whose average hourly taxi demand reaches about 300 vehicles per square kilometer have the largest TTD and most uneven TDD. The findings can support traffic management, land-use combination, and land-use adjustment to avoid concentrated taxi demand and mismatched TDD.;;;;;"Yu, Weijie/ITU-3183-2023; Wang, Xinhua/ISR-8520-2023";Yu, Weijie/0000-0002-7774-0109;;;;;;;;;;;;;0361-1981;2169-4052;;;;OCT;2021;2675;10;;;;;1268;1286;3611981211015260;10.1177/03611981211015259;http://dx.doi.org/10.1177/03611981211015259;;OCT 2021;;;;;;;;;;;WOS:000712153200001;
J;"Deng, YL; Juang, YJ";;;;"Deng, Yu-Luen; Juang, Yi-Je";;;Polydimethyl siloxane wet etching for three dimensional fabrication of microneedle array and high-aspect-ratio micropillars;BIOMICROFLUIDICS;;;;;;;;;;;;Among various transdermal drug delivery (TDD) approaches, utilizing the microneedles (MNs) not only can penetrate the skin but also deliver the drug with reduced tissue damage, reduced pain, and no bleeding. However, the MNs with larger height are required to overcome the skin barrier for effective TDD. Unlike 2D patterning, etching polydimethyl siloxane (PDMS) micropillars for fabrication of 3D microstructures is presented. The PDMS micropillars were first constructed by casting PDMS on the computer numerical control-machined cylindrical microwells, which then went through etching process to obtain the MNs for subsequent fabrication of polymer MNs or high aspect ratio micropillars. (C) 2014 AIP Publishing LLC.;;;;;;;;;;;;;;;;;;;1932-1058;;;;;MAR;2014;8;2;;;;;;;26502;10.1063/1.4871038;http://dx.doi.org/10.1063/1.4871038;;;;;;;;24803970;;;;;WOS:000336082100027;
J;"Kamble, SJ; Kounte, MR";;;;"Kamble, Shridevi Jeevan; Kounte, Manjunath R.";;;DYNAMIC TRAVELING ROUTE PLANNING METHOD FOR INTELLIGENT TRANSPORTATION USING INCREMENTAL LEARNING-BASED HYBRID DEEP LEARNING PREDICTION MODEL WITH FINE-TUNING;TRANSPORT AND TELECOMMUNICATION JOURNAL;;;;;;;;;;;;Predicting the most favorable traveling routes for Vehicles plays an influential role in Intelligent Transportation Systems (ITS). Shortest Traveling Routes with high congestion grievously affect the driving comfort level of VANET users in populated cities. As a result, increase in journey time and traveling cost. Predicting the most favorable traveling routes with less congestion is imperative to minimize the driving inconveniences. A major downside of existing traveling route prediction models is to continuously learn the real-time road congestion data with static benchmarking datasets. However, learning the new information with already learned data is a cumbersome task. The main idea of this paper is to utilize incremental learning on the Hybrid Learning-based traffic Congestion and Timing Prediction (HL-CTP) to select realistic, congestion-free, and shortest traveling routes for the vehicles. The proposed HL-CTP model is decomposed into three steps: dataset construction, incremental and hybrid prediction model, and route selection. Firstly, the HL-CTP constructs a novel Traffic and Timing Dataset (TTD) using historical traffic congestion information. The incremental learning method updates the novel real-time data continuously with the TDD during prediction to optimize the performance efficiency of the hybrid prediction model closer to real-time. Secondly, the hybrid prediction model with various deep learning models performs better by taking the route prediction decision based on the best sub-predictor results. Finally, the HL-CTP selects the most favorable vehicle routes selected using traffic congestion, timing, and uncertain environmental information and enhances the comfort level of VANET users. In the simulation, the proposed HL-CTP demonstrates superior performance in terms of Mean Square Error (MSE), Mean Absolute Error (MAE), and Root Mean Square Error (RMSE).;;;;;Kounte, Manjunath/O-2374-2018;Kounte, Manjunath/0000-0002-2432-2552;;;;;;;;;;;;;1407-6160;1407-6179;;;;NOV 1;2022;23;4;;;;;293;310;;10.2478/ttj-2022-0024;http://dx.doi.org/10.2478/ttj-2022-0024;;;;;;;;;;;;;WOS:000884899200003;
J;"Fujimoto, S; Itakura, H; Tanikawa, T; Okada, N; Tadatomo, K";;;;"Fujimoto, Satoru; Itakura, Hideyuki; Tanikawa, Tomoyuki; Okada, Narihito; Tadatomo, Kazuyuki";;;Growth of GaN and improvement of lattice curvature using symmetric hexagonal SiO2 patterns in HVPE growth;JAPANESE JOURNAL OF APPLIED PHYSICS;;;;;International Workshop on Nitride Semiconductors (IWN);NOV 11-16, 2018;Kanazawa, JAPAN;;;;;"We implemented facet and flattening (FF) growth via hydride vapor phase epitaxy, and applied hexagonal SiO2 mask patterns to minimize the final threading dislocation density (TDD). We found that the FF growth technique with hexagonal masks significantly mitigates the lattice curvature. Following multiple growth steps, an isotropic curvature could be observed owing to the planar symmetry of the mask patterns; the radius of curvature was 55 m. Furthermore, TDD was significantly reduced to 6.8 x 10(5) cm(-2). These results indicate that the hexagonal mask technique is effective for improving both lattice curvature and crystalline quality of a GaN substrate. (C) 2019 The Japan Society of Applied Physics";;;;;;;;;;;;;;;;;;;0021-4922;1347-4065;;;;JUN 1;2019;58;;;;C;;;;SC1049;10.7567/1347-4065/ab1125;http://dx.doi.org/10.7567/1347-4065/ab1125;;;;;;;;;;;;;WOS:000474911400057;
J;"Samuel, OW; Geng, YJ; Li, XX; Li, GL";;;;"Samuel, Oluwarotimi Williams; Geng, Yanjuan; Li, Xiangxin; Li, Guanglin";;;Towards Efficient Decoding of Multiple Classes of Motor Imagery Limb Movements Based on EEG Spectral and Time Domain Descriptors;JOURNAL OF MEDICAL SYSTEMS;;;;;;;;;;;;To control multiple degrees of freedom (MDoF) upper limb prostheses, pattern recognition (PR) of electromyogram (EMG) signals has been successfully applied. This technique requires amputees to provide sufficient EMG signals to decode their limb movement intentions (LMIs). However, amputees with neuromuscular disorder/high level amputation often cannot provide sufficient EMG control signals, and thus the applicability of the EMG-PR technique is limited especially to this category of amputees. As an alternative approach, electroencephalograph (EEG) signals recorded non-invasively from the brain have been utilized to decode the LMIs of humans. However, most of the existing EEG based limb movement decoding methods primarily focus on identifying limited classes of upper limb movements. In addition, investigation on EEG feature extraction methods for the decoding of multiple classes of LMIs has rarely been considered. Therefore, 32 EEG feature extraction methods (including 12 spectral domain descriptors (SDDs) and 20 time domain descriptors (TDDs)) were used to decode multiple classes of motor imagery patterns associated with different upper limb movements based on 64-channel EEG recordings. From the obtained experimental results, the best individual TDD achieved an accuracy of 67.05 +/- 3.12% as against 87.03 +/- 2.26% for the best SDD. By applying a linear feature combination technique, an optimal set of combined TDDs recorded an average accuracy of 90.68% while that of the SDDs achieved an accuracy of 99.55% which were significantly higher than those of the individual TDD and SDD at p < 0.05. Our findings suggest that optimal feature set combination would yield a relatively high decoding accuracy that may improve the clinical robustness of MDoF neuroprosthesis.;;;;;Samuel, Oluwarotimi Williams/AAE-6996-2020;"Samuel, Oluwarotimi Williams/0000-0003-1945-1402; Li, Guanglin/0000-0001-9016-2617";;;;;;;;;;;;;0148-5598;1573-689X;;;;DEC;2017;41;12;;;;;;;;10.1007/s10916-017-0843-z;http://dx.doi.org/10.1007/s10916-017-0843-z;;;;;;;;29080913;;;;;WOS:000414001400001;
J;"Uesugi, K; Hayashi, Y; Shojiki, K; Miyake, H";;;;"Uesugi, Kenjiro; Hayashi, Yusuke; Shojiki, Kanako; Miyake, Hideto";;;Reduction of threading dislocation density and suppression of cracking in sputter-deposited AIN templates annealed at high temperatures;APPLIED PHYSICS EXPRESS;;;;;;;;;;;;Combination of sputter deposition and high-temperature annealing is a promising technique for preparing AIN templates with a low threading dislocation density (TDD) at a lower film thickness compared to those prepared by the conventional metalorganic vapor phase epitaxy. However, cracking of AIN films during annealing is a critical issue. In this study, we controlled the residual stress of the sputter-deposited AIN films by modifying the sputtering conditions. Consequently, the occurrence of cracking was effectively suppressed. By optimizing the fabricating conditions, a TDD of 2.07 x 10(8) cm(-2) was achieved for the AIN template with a thickness of 480 nm. (C) 2019 The Japan Society of Applied Physics;;;;;"Miyake, Hideto/AAT-4804-2020; HAYASHI, Yusuke/ING-0401-2023";"HAYASHI, Yusuke/0000-0001-5672-1497; Shojiki, Kanako/0000-0003-0781-7016";;;;;;;;;;;;;1882-0778;1882-0786;;;;JUN 1;2019;12;6;;;;;;;65501;10.7567/1882-0786/ab1ab8;http://dx.doi.org/10.7567/1882-0786/ab1ab8;;;;;;;;;;;;;WOS:000467688700001;
J;"Jeong, I; Nakagawa, M";;;;"Jeong, I; Nakagawa, M";;;A novel transmission diversity system in TDD-CDMA;IEICE TRANSACTIONS ON COMMUNICATIONS;;;;;;;;;;;;This paper presents a novel transmission diversity scheme for code division multiple access system. Conventional diversity receivers in mobile stations require space and complicated circuits, however, the proposed diversity schemes present significant diversity effect without any diversity equipment at the mobile station. It is possible to use the transmitter diversity at the base station by using the feature of time division duplex (TDD) which has strongly correlated fading patterns in both forward and reverse link. Computer simulation is performed to evaluate the performance of the proposed systems for single user environment. The performance of the system 1, which select best situated antenna, is analyzed and the BER performance for multiple access is presented.;;;;;;;;;;;;;;;;;;;0916-8516;1745-1345;;;;JUL;1998;E81B;7;;;;;1409;1416;;;;;;;;;;;;;;;;WOS:000075094000015;
J;"Jeon, CE; Hwang, SH";;;;"Jeon, Cha-Eul; Hwang, Seung-Hoon";;;Antenna Switching Schemes for Downlink Time Switched Transmit Diversity with ARQ in Rayleigh Fading Channels;IEICE TRANSACTIONS ON COMMUNICATIONS;;;;;;;;;;;;For automatic repeat request (ARQ)-aided TSTD (Time Switched Transmit Diversity) system, a receiver sends the acknowledgement signal (ACK or NACK) to a transmitter in order to predict the condition of the channel In this paper. two antenna switching schemes, in which the NACK trigger the transmit antenna switching in the proposed antenna switching patterns. are proposed for the TSTD with the ARQ in WCDMA LCR-TDD systems In addition, the system performances are investigated Simulation results demonstrate that the performances of the TSTD systems can be improved by applying the ARQ scheme Furthermore, the performances of ARQ-aided TSTD systems may be significantly improved by applying the proposed antenna switching scheme,. especially when the mobile's speed is low;;;;;Hwang, Seung-Hoon/T-8027-2018;;;;;;;;;;;;;;0916-8516;1745-1345;;;;MAR;2010;E93B;3;;;;;780;783;;10.1587/transcom.E93.B.780;http://dx.doi.org/10.1587/transcom.E93.B.780;;;;;;;;;;;;;WOS:000276760700051;
C;"Kim, K; Hong, CS";;;IEEE;"Kim, Kitae; Hong, Choong Seon";;;Pruned Autoencoder based mmWave Channel Estimation in RIS-Assisted Wireless Networks;2022 23RD ASIA-PACIFIC NETWORK OPERATIONS AND MANAGEMENT SYMPOSIUM (APNOMS 2022);Asia-Pacific Network Operations and Management Symposium-APNOMS;;;;23rd Asia-Pacific Network Operations and Management Symposium (APNOMS);SEP 28-30, 2022;Takamatsu, JAPAN;IEICE ICM,IEEE,IEEE Commun Soc;;;;Accurate channel estimation is an essential factor in determining the efficiency of a wireless communication system. Moreover, in Reconfigurable Intelligent Surfaces(RIS)-Assisted wireless networks using millimeter wave(mmWave), it is crucial to optimize each RIS element's phase shift. Therefore, in this paper, we propose a channel estimation method in TDD-based wireless communication system using autoencoder in RIS-Assisted wireless networks. The trade-off relationship between channel estimation accuracy and the number of pilot signals is optimized when performing channel estimation. Through denoising autoencoder and Average Percentage of Zeros(APoZ), we find the optimal pilot pattern considering not only the number of pilots but also the location. As a result of the experiment, the proposed method has little difference in performance or outperforms the full neural network without pruning.;;;;;Hong, Choong Seon/ABF-5527-2020;;;;;;;;;;;;;;2576-8565;2576-8557;978-4-885-52339-7;;;;2022;;;;;;;327;330;;;;;;;;;;;;;;;;WOS:000936130200064;
J;"Kim, JW; Jung, TH; Ryu, HK; Woo, JM; Eun, CS; Lee, DK";;;;"Kim, Jun-Won; Jung, Tae-Hwan; Ryu, Hong-Kyun; Woo, Jong-Myung; Eun, Chang-Soo; Lee, Dong-Kook";;;Compact Multiband Microstrip Antenna Using Inverted-L- and T-Shaped Parasitic Elements;IEEE ANTENNAS AND WIRELESS PROPAGATION LETTERS;;;;;;;;;;;;By placing inverted-L- and T-shaped parasitic elements at both the radiating apertures of a microstrip patch antenna, a low-profile, compact single-layer multiband microstrip antenna operable in various bands has been developed. These bands include LTE TDD No. 34 (2.0175 GHz), WLAN (2.45 GHz), and WiMAX (3.5 GHz) bands. The antenna has dimensions of, where is the free-space wavelength at 2.0175 GHz, and resonance in the parasitic elements occurs through coupling and perturbations to the microstrip patch. In each band, the measured -10-dB bandwidths cover the required bandwidths at 28 MHz (1.39%), 91 MHz (3.71%), and 255 MHz (7.29%). Within each of the designed bands, a broadside radiation pattern is observed.;;;;;;Woo, Jong-Myung/0000-0001-5796-5426;;;;;;;;;;;;;1536-1225;1548-5757;;;;;2013;12;;;;;;1299;1302;;10.1109/LAWP.2013.2283796;http://dx.doi.org/10.1109/LAWP.2013.2283796;;;;;;;;;;;;;WOS:000326184800005;
C;"Wang, H; Bao, JL; Ge, JG; Wu, P";;;IEEE;"Wang, H; Bao, JL; Ge, JG; Wu, P";;;Network thermodynamic model of drug transfer through skin for transdermal drug delivery in vitro;PROCEEDINGS OF THE 25TH ANNUAL INTERNATIONAL CONFERENCE OF THE IEEE ENGINEERING IN MEDICINE AND BIOLOGY SOCIETY, VOLS 1-4: A NEW BEGINNING FOR HUMAN HEALTH;PROCEEDINGS OF ANNUAL INTERNATIONAL CONFERENCE OF THE IEEE ENGINEERING IN MEDICINE AND BIOLOGY SOCIETY;;;;25th Annual International Conference of the IEEE-Engineering-in-Medicine-and-Biology-Society;SEP 17-21, 2003;Cancun, MEXICO;IEEE Engn Med & Biol Soc,Coral,Univ Autonome Metropolitana,Sandia Natl Lab;;;;"Purpose: To illustrate the non-equilibrium properties of drug permeation through stratum corneum (SC) to provide theory and method for transdermal drug delivery (TDD). Methods: The side-by-side permeation cell in vitro was supposed to be isolated system, thus conditions for equilibrium state were decided. And a network thermodynamic model was established. We completed non-equilibrium experiment with which Tinidazole was pattern drug. Results: The properties of non-equilibrium including: (1) Long term to reach equilibrium state; (2) Delay-start of the permeation; (3) Uncertainty of initial drug permeable flux. The properties of leakage including: (1) Degression of drug permeable flux; (2) Changeability of permeation time constant. Conclusions: The permeation cell is believed to be a non-linear and time variable system.";;;;;;;;;;;;;;;;;;;1094-687X;;0-7803-7789-3;;;;2003;25;;1-4;;;;2966;2969;;10.1109/IEMBS.2003.1280541;http://dx.doi.org/10.1109/IEMBS.2003.1280541;;;;;;;;;;;;;WOS:000189395300769;
C;"Hirayama, H; Tomita, Y; Toyoda, S; Fujikawa, S; Kamata, N";;;IEEE;"Hirayama, H.; Tomita, Y.; Toyoda, S.; Fujikawa, S.; Kamata, N.";;;AlGaN-based Deep-UV LEDs Fabricated on Connected-Pillar AlN Buffer;2013 CONFERENCE ON LASERS AND ELECTRO-OPTICS PACIFIC RIM (CLEO-PR);;;;;10th Conference on Lasers and Electro-Optics Pacific Rim (CLEO-PR);JUN 30-JUL 04, 2013;Kyoto, JAPAN;IEICE Commun Soc,IEICE Elect Soc,Japan Soc Appl Phys,IEEE Photon Soc,Opt Soc,Opt Soc Korea,Korean Phys Soc,Agilent Technologies Japan Ltd,Hamamatsu Photon K K,Tektronix Japan,Thorlabs Japan Inc;;;;260 nm-band AlGaN deep-ultraviolet (DUV) light-emitting diodes (LED) was fabricated on a connected-pillar AlN buffer layer grown on a sapphire substrate. Low threading dislocation density (TDD) connected-pillar AlN buffer is considered to be quite effective for obtaining high internal quantum efficiency (IQE) and light-extraction efficiency (LEE) in DUV-LEDs. We fabricated an AlN pillar array structure with accurate hexagonal shape pillars grown on a patterned sapphire substrate (PSS) by using an NH3 pulsed flow multi-layer (ML) growth and an epitaxial lateral overgrowth (ELO). The AlN pillars were connected to be flat surface AlN buffer layer with low TDD, through ELO process. We fabricated AlGaN quantum well (QW) DUV-LED on a connected-pillar AlN buffer. The output power obtained was 5.5 mW for 265 nm LED measured under room temperature cw operation.;;;;;"Hirayama, Hideki/B-9830-2015; Kamata, Norihiko/G-1450-2012";"Hirayama, Hideki/0000-0003-1253-6278;";;;;;;;;;;;;;;;978-1-4673-6476-8;;;;2013;;;;;;;;;;;;;;;;;;;;;;;;WOS:000334176100297;
J;"Kim, S; Kim, J";;;;"Kim, Sangkil; Kim, Jusung";;;Design of Reconfigurable Antenna Feeding Network Using Coupled-line Switch for 5G Millimeter-wave Communication System;APPLIED COMPUTATIONAL ELECTROMAGNETICS SOCIETY JOURNAL;;;;;;;;;;;;In this paper, a reconfigurable antenna feeding network using coupled line switches for 5G communication system is presented. Two quarter-wave impedance transformers were integrated to support TDD operation and a single stage coupled line filter was used as a DC block for RF switches instead of using conventional surface mounting components. Design equations and theoretical analysis for the proposed reconfigurable antenna feeding network are also presented. To demonstrate the performance of the proposed reconfigurable antenna feeding system for MIMO, two monopole antennas were integrated orthogonally to the designed feeding network. Vertical or horizontal polarization was successfully formed and the radiation pattern can be selectable by manipulating the switches.;;;;;;;;;;;;;;;;;;;1054-4887;1943-5711;;;;AUG;2018;33;8;;;;;861;867;;;;;;;;;;;;;;;;WOS:000446564000007;
C;"Jia, YJ; Hara, S; Hara, Y";;;"IEEE; IEEE";"Jia, YJ; Hara, S; Hara, Y";;;Impact of closed-loop power control on SDMA/TDMA system performance;IEEE 56TH VEHICULAR TECHNOLOGY CONFERENCE, VTC FALL 2002, VOLS 1-4, PROCEEDINGS;IEEE Vehicular Technology Conference Proceedings;;;;56th IEEE Vehicular Technology Conference;SEP 24-28, 2002;VANCOUVER, CANADA;IEEE Vehicular Technol Soc;;;;Power control is an important system requirement in SDMA (Space Division Multiple Access) to compensate for inequality of signal quality among near-end and far-end terminals. This paper presents a closed-loop power control scheme in an SDMA system to achieve the optimal power allocation and beam pattern for both uplink and downlink in the entire network. The performance of the proposed scheme is evaluated by computer simulation in terms of blocking rate and forced termination rate of a TDD-SDMA/TDMA system in a multi-cell wireless system, and it is also compared with an open-loop power control scheme. The numerical results show that the system with the closed-loop power control has significantly better performance than that with the open-loop power control. Our investigation indicates the closed-loop power control scheme has a large impact on SDMA/TDMA system performance, where the remarkable improvement in system capacity can be achieved.;;;;;;;;;;;;;;;;;;;2577-2465;;0-7803-7467-3;;;;2002;;;;;;;1825;1829;;;;;;;;;;;;;;;;WOS:000179406100375;
C;"Marx, F; Farah, J";;;ieee;"Marx, F; Farah, J";;;Improved turbo-coded UMTS systems with Unequal Error Protection of compressed video sequences transmitted over frequency-selective channels;2004 IEEE INTERNATIONAL CONFERENCE ON COMMUNICATIONS, VOLS 1-7;;;;;IEEE International Conference on Communications (ICC 2004);JUN 20-24, 2004;Paris, FRANCE;IEEE,Alcatel,France Telecom,Cegetel Grp,Thales,Bouygues Telecom,Siemens,Siemens Mobile,Mitsubishi,GET,IEEE Commun Soc,EUREL,ICC GLOBECOM;;;;A novel Unequal Error Protection technique is presented for the transmission of H263 compressed and turbo-coded video sequences over it UMTS/TDD wireless system. The overall redundancy added to the compressed stream is non-uniformly distributed between the succeeding video frames in order to minimize the mean distortion over the transmitted sequence. The repartition of the redundancy on the video stream is optimized using an analytical approach which aims to alleviate the error propagation along the sequence. Different puncturing patterns of the rate 1/3 turbo-coder were considered in our simulations. Experimental results show that the gain (in terms of the Peak Signal to Noise Ratio) over the classical Equal Error Protection scheme can reach 1.5 dB without any increase in the transmission rate or the receiver complexity.;;;;;;;;;;;;;;;;;;;;;0-7803-8533-0;;;;2004;;;;;;;3091;3095;;10.1109/ICC.2004.1313100;http://dx.doi.org/10.1109/ICC.2004.1313100;;;;;;;;;;;;;WOS:000223459600603;
J;"Masuda, Y; Sugiyama, T; Lin, H; Seo, WS; Koumoto, K";;;;"Masuda, Y; Sugiyama, T; Lin, H; Seo, WS; Koumoto, K";;;Selective deposition and micropatterning of titanium dioxide thin film on self-assembled monolayers;THIN SOLID FILMS;;;;;;;;;;;;We succeeded in fabricating micropatterns of titanium dioxide thin films on SAMs (self-assembled monolayers). SAMs of OTS (octadecyltrichloro-silane) were formed on Si wafers, and were modified by UV irradiation using a photomask to generate methyl/silanol-pattem. They were used as templates to deposit titanium dioxide thin films by the use of TDD (titanium dichloride diethoxide). Amorphous films with approximate compositions Ti/O/CI/C = 1:2.2:0.17:0.37 were selectively deposited on silanol regions. Line width variation of the pattern of an as-deposited film was improved to be well below the electronics design rule, 5%. Annealing the films at high temperatures (400-600 degreesC) gave rise to an anatase phase, while the resolution of a micropattern remained unchanged. (C) 2001 Elsevier Science B.V. All rights reserved.;;;;;Masuda, Yoshitake/I-3882-2012;Masuda, Yoshitake/0000-0002-4710-1306;;;;;;;;;;;;;0040-6090;1879-2731;;;;FEB 1;2001;382;1-2;;;;;153;157;;10.1016/S0040-6090(00)01761-2;http://dx.doi.org/10.1016/S0040-6090(00)01761-2;;;;;;;;;;;;;WOS:000167268700023;
